{
  "spec_version": "1.0",
  "event_id": "01928f3a-0000-7a00-8000-000000000002",
  "event_type": "site.status",
  "occurred_at": "2026-10-02T18:00:00+05:00",
  "source": {
    "system": "buildops",
    "system_version": "2.0.10"
  },
  "organization": {
    "stir": "305123456"
  },
  "site_id": "obyekt-17",
  "data": {
    "status": "suspended",
    "effective_on": "2026-10-03",
    "reason": "Buyurtmachi loyiha o'zgarishini kutmoqda"
  }
}
