{
  "spec_version": "1.0",
  "event_id": "01928f3a-0000-7a00-8000-000000000006",
  "event_type": "site.photo",
  "occurred_at": "2026-10-02T16:42:10+05:00",
  "source": {
    "system": "buildops",
    "system_version": "2.0.10"
  },
  "organization": {
    "stir": "305123456"
  },
  "site_id": "obyekt-17",
  "data": {
    "media_id": "01928f3b-1111-7a00-8000-0000000000aa",
    "sha256": "9f2c6d0f7a3b1e5c8d4a2b6e0f1c3d5e7a9b0c2d4e6f8a1b3c5d7e9f0a2b4c6d",
    "taken_at": "2026-10-02T16:41:55+05:00",
    "location": {
      "lat": 39.0349,
      "lng": 66.5719
    },
    "caption": "Poydevor armaturasi, 2-seksiya"
  }
}
